{
  "schemaVersion": 1,
  "title": "Pocket Pong",
  "description": "A brisk one-player paddle match against a surprisingly determined little computer.",
  "instructions": "Press New game. Move with W/S, the arrow keys, touch the court, or use the Up and Down buttons. First to seven points wins.",
  "orientation": "landscape",
  "controls": ["Arrow keys", "WASD", "Touch", "Touch buttons"],
  "tags": ["arcade", "sports"],
  "capabilities": ["scores"],
  "display": { "mode": "responsive" },
  "score": { "label": "Points", "order": "higher" }
}
